{
  "version": "https://jsonfeed.org/version/1.1",
  "title": "HECAVEX Radar changes: Lietuvos paštas",
  "home_page_url": "https://radar.hecavex.com/brands/lietuvos-pastas/",
  "feed_url": "https://radar.hecavex.com/data/brands/lietuvos-pastas/events.feed.json",
  "language": "en",
  "items": []
}
