{
  "version": "https://jsonfeed.org/version/1.1",
  "title": "HECAVEX Radar changes: Registrų centras",
  "home_page_url": "https://radar.hecavex.com/brands/registru-centras/",
  "feed_url": "https://radar.hecavex.com/data/brands/registru-centras/events.feed.json",
  "language": "en",
  "items": [
    {
      "id": "urn:hecavex-radar:event:91bcfce4820cd4fc6f5b50bddeff43c8",
      "url": "https://radar.hecavex.com/signals/6498af879e147eca9345/",
      "title": "Reobserved: xn--registrcentras-m8c[.]lt",
      "content_text": "The Registrų centras candidate was observed again. Source: CertStream. Indicator: xn--registrcentras-m8c[.]lt.",
      "date_published": "2026-09-22T18:38:01.520Z",
      "tags": [
        "reobservation",
        "Registrų centras"
      ]
    }
  ]
}
